{
  "$schema": "http://json-schema.org/draft-06/schema#",
  "id": "http://hl7.org/fhir/json-schema/CarePlan",
  "description": "Describes the intention of how one or more practitioners intend to deliver care for a particular patient.",
  "type": "object",
  "required": ["resourceType", "subject"],
  "properties": {
    "resourceType": { "const": "CarePlan" },
    "id": { "type": "string", "description": "Logical id of this artifact" },
    "_id": { "type": "string", "description": "MongoDB primary key" },
    "meta": { "type": "object", "properties": { "versionId": { "type": "string" }, "lastUpdated": { "type": "string" }, "source": { "type": "string" }, "profile": { "type": "array", "items": { "type": "string" } }, "security": { "type": "array", "items": { "type": "object", "properties": { "system": { "type": "string" }, "code": { "type": "string" }, "display": { "type": "string" } } } }, "tag": { "type": "array", "items": { "type": "object", "properties": { "system": { "type": "string" }, "code": { "type": "string" }, "display": { "type": "string" } } } } } },
    "implicitRules": { "type": "string" },
    "language": { "type": "string" },
    "text": { "type": "object", "properties": { "status": { "type": "string" }, "div": { "type": "string" } } },
    "contained": { "type": "array", "items": { "type": "object" } },
    "extension": { "type": "array", "items": { "type": "object" } },
    "modifierExtension": { "type": "array", "items": { "type": "object" } },
    "identifier": { "type": "array", "items": { "type": "object", "properties": { "use": { "type": "string" }, "system": { "type": "string" }, "value": { "type": "string" } } } },
    "instantiatesCanonical": { "type": "array", "items": { "type": "string" } },
    "instantiatesUri": { "type": "array", "items": { "type": "string" } },
    "basedOn": { "type": "array", "items": { "type": "object", "properties": { "reference": { "type": "string" }, "display": { "type": "string" } } } },
    "replaces": { "type": "array", "items": { "type": "object", "properties": { "reference": { "type": "string" }, "display": { "type": "string" } } } },
    "partOf": { "type": "array", "items": { "type": "object", "properties": { "reference": { "type": "string" }, "display": { "type": "string" } } } },
    "status": { "type": "string", "enum": ["draft", "active", "on-hold", "revoked", "completed", "entered-in-error", "unknown"] },
    "intent": { "type": "string", "enum": ["proposal", "plan", "order", "option"] },
    "category": { "type": "array", "items": { "type": "object", "properties": { "coding": { "type": "array", "items": { "type": "object", "properties": { "system": { "type": "string" }, "code": { "type": "string" }, "display": { "type": "string" } } } }, "text": { "type": "string" } } } },
    "title": { "type": "string" },
    "description": { "type": "string" },
    "subject": { "type": "object", "properties": { "reference": { "type": "string" }, "display": { "type": "string" } } },
    "encounter": { "type": "object", "properties": { "reference": { "type": "string" }, "display": { "type": "string" } } },
    "period": { "type": "object", "properties": { "start": { "type": "string" }, "end": { "type": "string" } } },
    "created": { "type": "string" },
    "author": { "type": "object", "properties": { "reference": { "type": "string" }, "display": { "type": "string" } } },
    "contributor": { "type": "array", "items": { "type": "object", "properties": { "reference": { "type": "string" }, "display": { "type": "string" } } } },
    "careTeam": { "type": "array", "items": { "type": "object", "properties": { "reference": { "type": "string" }, "display": { "type": "string" } } } },
    "addresses": { "type": "array", "items": { "type": "object", "properties": { "reference": { "type": "string" }, "display": { "type": "string" } } } },
    "supportingInfo": { "type": "array", "items": { "type": "object", "properties": { "reference": { "type": "string" }, "display": { "type": "string" } } } },
    "goal": { "type": "array", "items": { "type": "object", "properties": { "reference": { "type": "string" }, "display": { "type": "string" } } } },
    "activity": { "type": "array", "items": { "type": "object", "properties": { "outcomeCodeableConcept": { "type": "array", "items": { "type": "object", "properties": { "coding": { "type": "array", "items": { "type": "object", "properties": { "system": { "type": "string" }, "code": { "type": "string" }, "display": { "type": "string" } } } }, "text": { "type": "string" } } } }, "outcomeReference": { "type": "array", "items": { "type": "object", "properties": { "reference": { "type": "string" }, "display": { "type": "string" } } } }, "progress": { "type": "array", "items": { "type": "object", "properties": { "text": { "type": "string" }, "time": { "type": "string" } } } }, "reference": { "type": "object", "properties": { "reference": { "type": "string" }, "display": { "type": "string" } } }, "detail": { "type": "object", "properties": { "kind": { "type": "string" }, "instantiatesCanonical": { "type": "array", "items": { "type": "string" } }, "code": { "type": "object", "properties": { "coding": { "type": "array", "items": { "type": "object", "properties": { "system": { "type": "string" }, "code": { "type": "string" }, "display": { "type": "string" } } } }, "text": { "type": "string" } } }, "status": { "type": "string" }, "statusReason": { "type": "object" }, "doNotPerform": { "type": "boolean" }, "scheduledTiming": { "type": "object" }, "scheduledPeriod": { "type": "object", "properties": { "start": { "type": "string" }, "end": { "type": "string" } } }, "scheduledString": { "type": "string" }, "location": { "type": "object", "properties": { "reference": { "type": "string" }, "display": { "type": "string" } } }, "performer": { "type": "array", "items": { "type": "object", "properties": { "reference": { "type": "string" }, "display": { "type": "string" } } } }, "productCodeableConcept": { "type": "object" }, "productReference": { "type": "object", "properties": { "reference": { "type": "string" }, "display": { "type": "string" } } }, "dailyAmount": { "type": "object", "properties": { "value": { "type": "number" }, "unit": { "type": "string" } } }, "quantity": { "type": "object", "properties": { "value": { "type": "number" }, "unit": { "type": "string" } } }, "description": { "type": "string" } } } } } },
    "note": { "type": "array", "items": { "type": "object", "properties": { "text": { "type": "string" }, "time": { "type": "string" }, "authorReference": { "type": "object", "properties": { "reference": { "type": "string" }, "display": { "type": "string" } } }, "authorString": { "type": "string" } } } }
  }
}
